Age,Source of Wealth,Self-Made Score,Philanthropy Score,Residence,Citizenship,Marital Status,Children,Education
62,"Finance, Self Made",8,2,"Los Angeles, California",United States,Married,3,"Master of Business Administration, Columbia Business School; Bachelor of Arts/Science, Georgetown University"
66,"Food, beverages",,,"Shanghai, China",Taiwan,Married,2,
58,"Private equity, Self Made",8,2,"Miami, Florida",United States,Married,5,"Master of Business Administration, Harvard University; Bachelor of Arts/Science, University of Pennsylvania, The Wharton School"
75,Medical devices,,,"Humlebaek, Denmark",Denmark,Married,1,
71,"Pharmaceuticals, Self Made",9,2,"Los Angeles, California",United States,Married,2,"Master of Science, University of British Columbia; Bachelor of Arts/Science, University of Witwatersrand; Medical Doctor, University of Witwatersrand"
56,"Steel, coal, Self Made",,,"Donetsk, Ukraine",Ukraine,Married,2,"Bachelor of Arts/Science, Donetsk National University"
88,"Medical equipment, Self Made",6,2,"Atlanta, Georgia",United States,Married,2,"Bachelor of Science in Engineering, Auburn University"
76,"Record label, Self Made",,,"Grand Cayman, Cayman Islands",United Kingdom,Married,2,
93,Oil,,,"Saint John, Canada",Canada,Married,5,
72,"Real estate, investments",,,"Stockholm, Sweden",Sweden,Married,2,"Bachelor of Arts/Science, Stockholm School of Economics"
77,Cement,,,"Jona, Switzerland",Switzerland,Married,4,"Doctorate, Tufts University; Bachelor of Arts/Science, Zurich Polytechnic"
83,Shipping,,,"Hong Kong, Hong Kong",Austria,Married,3,"Doctor of Jurisprudence, Southern Methodist University; Bachelor of Arts/Science, University of Vienna"
51,Investments,4,1,"New York, New York",United States,Married,1,"Bachelor of Arts/Science, Columbia University"
59,Investments,4,1,"North Palm Beach, Florida",United States,Married,2,"Bachelor of Arts/Science, Columbia University; Master of Business Administration, Harvard University"
57,Investments,4,1,"New York, New York",United States,Married,2,"Doctor of Jurisprudence, Cornell University; Bachelor of Arts/Science, Harvard University"
41,Shipping,,,Greece,Greece,Married,3,"Medical Doctor, Cambridge; University College London"
80,"Oil, real estate",5,2,"Dallas, Texas",United States,Married,5,"Bachelor of Arts/Science, Southern Methodist University"
52,"Package delivery, Self Made",,,"Shanghai, China",China,,,
81,Motorcycles,,,"Delhi, India",India,Married,3,
87,"Investments, Self Made",9,3,"Sands Point, New York",United States,Married,3,"Bachelor of Arts/Science, Bucknell University; Master of Business Administration, Leonard N. Stern School of Business"
56,"Pharmaceutical ingredients, Self Made",8,,"Shanghai, China",United States,Widowed,,"Ph.D, Columbia University"
65,"Hotels, investments",3,2,"Branford, Connecticut",United States,Widowed,4,"Bachelor of Arts/Science, Northwestern University"
69,"Hotels, investments",5,2,"Dallas, Texas",United States,Married,2,"Doctor of Jurisprudence, Southern Methodist University; Bachelor of Arts/Science, The University of Texas at Austin"
51,"Gambling software, Self Made",,,"Tel Aviv, Israel",Israel,In Relationship,6,
65,"Biotech, Self Made",,,"Seoul, South Korea",South Korea,Married,2,"Bachelor of Arts/Science, Konkuk University; Master of Science, Konkuk University"
59,"Auto parts, Self Made",,,"Ningbo, China",Hong Kong,,,
74,Carnival Cruises,5,1,"Bal Harbour, Florida",United States,Married,2,"Drop Out, University of Miami"
66,"Media, automotive",1,1,"Palisades, New York",United States,Married,2,"Bachelor of Arts/Science, Bard College"
66,"Electronics, Self Made",,,"Taipei, Taiwan",Taiwan,Divorced,3,"Bachelor of Arts/Science, National Cheng Kung University"
33,"Payments software, Self Made",,,"San Francisco, California",Ireland,Single,,"Drop Out, Harvard University"
34,"Payment software, Self Made",,,"San Francisco, California",Ireland,Married,,"Drop Out, Massachusetts Institute of Technology"
94,"Timberland, lumber mills, Self Made",9,1,"Redding, California",United States,Married,3,"Diploma, High School"
78,Automobiles,,,"Modena, Italy",Italy,Divorced,1,
58,Toyota dealerships,4,3,"Houston, Texas",United States,Married,4,"Bachelor of Arts/Science, Georgetown University; Master of Business Administration, Rice University"
95,Diversified,,,"Saint John, Canada",Canada,Married,4,
68,"Chemicals, Self Made",,,"Chengdu, China",China,Married,1,"Bachelor of Science in Engineering, Xihua University"
82,"Pharmaceuticals, Self Made",,,"Heidelberg, Germany",Germany,Married,3,
58,Pharmaceuticals,,,"Ulm, Germany",Germany,Married,2,
67,"Manufacturing, investments, Self Made",7,2,"Potomac, Maryland",United States,Married,2,"Bachelor of Arts/Science, Miami University of Ohio"
78,"Media, automotive",1,1,"East Hampton, New York",United States,Widowed,,"Bachelor of Arts/Science, Sarah Lawrence college"
57,"Finance, Self Made",,,"Hong Kong, Hong Kong",Chile,Married,4,"Bachelor of Business Administration, University of Pennsylvania, The Wharton School"
79,"Hedge funds, Self Made",8,2,"New York, New York",United States,In Relationship,,"Doctor of Jurisprudence, Harvard University; Bachelor of Arts/Science, University of Rochester"
80,"Medical packaging, Self Made",,,"Venice, Italy",Italy,Married,2,"Law Degree, University of Ferrara"
81,"Media, automotive",1,1,"Southampton, New York",United States,,,"Bachelor of Arts/Science, Finch College"
68,"Software, Self Made",,,"Sydney, Australia",Australia,,2,"Master of Business Administration, University of Technology, Sydney"
56,"Biotech, Self Made",,,"Beijing, China",China,,,"Master of Business Administration, Fordham University"
77,"Luxury goods, Self Made",,,"Milan, Italy",Italy,Married,2,"Master of Business Administration, University of Florence"
82,Paints,,,"Mumbai, India",India,Married,2,"Bachelor of Engineering, University of Mumbai; Master of Science, University of Mumbai"
43,Mortgage lender,5,1,"Bloomfield Hills, Michigan",United States,Divorced,3,"Bachelor of Business Administration, Michigan State University"
68,"IT provider, Self Made",8,1,"Singapore, Singapore",United States,Divorced,1,"Master, Columbia University; Law Degree, New York Law School"
58,"Textiles, petrochemicals, Self Made",,,"Suzhou, China",China,,,
77,"Kitchen appliances, Self Made",,,"Lucerne, Switzerland",Switzerland,Married,2,"Master of Business Administration, St Gallen University"
74,Luxury goods,,,"Milan, Italy",Italy,Married,2,"Doctorate, University of Milan; Doctorate in Pedagogical Sciences, University of Milan"
70,Consumer goods,,,"Passau, Germany",Germany,,,
58,Consumer goods,,,"Munich, Germany",Germany,,,
60,Consumer goods,,,"Vienna, Austria",Germany,,,
71,Consumer goods,,,"Vienna, Austria",Germany,,,
49,"Finance, Self Made",7,,"Darien, Connecticut",United States,Married,3,"Bachelor of Business Administration, College of William & Mary"
64,"Real estate, Self Made",7,2,"Los Angeles, California",United States,Married,4,"Doctor of Jurisprudence, Pepperdine University; Bachelor of Arts/Science, University of Southern California"
60,"Carpet, Self Made",,,"Istanbul, Turkey",Turkey,Married,3,
60,Fidelity,1,2,"Boston, Massachusetts",United States,,,"Bachelor of Arts/Science, Franklin Pierce University"
66,"Venture capital, Self Made",,,,,,,
79,Petrochemicals,,,"Jakarta, Indonesia",Indonesia,Married,3,
73,"Hotels, investments",4,2,"Chicago, Illinois",United States,Married,3,"Bachelor of Arts/Science, Claremont McKenna College; Doctor of Jurisprudence, University of Chicago; Master of Business Administration, University of Chicago"
80,"Agriculture, Self Made",8,3,"Los Angeles, California",United States,Married,5,
86,"Agriculture, Self Made",8,3,"Beverly Hills, California",United States,Married,5,
78,Pest control,3,1,"Atlanta, Georgia",United States,Divorced,4,"Bachelor of Arts/Science, University of Tennessee Chattanooga"
63,"Finance, asset management, Self Made",8,2,"Chicago, Illinois",United States,Married,1,"Bachelor of Arts/Science, Creighton University; Doctor of Jurisprudence, Northwestern University"
82,"Furniture, Self Made",7,2,"Saint Petersburg, Florida",United States,Married,3,"High School Graduate, High School"
78,"Poultry genetics, Self Made",,,"Visbek, Germany",Germany,Married,3,
67,"Retail, Self Made",,,"Abu Dhabi, United Arab Emirates",India,Married,3,
56,"Investments, Self Made",,,"Greenwich, Connecticut",Brazil,Married,,"EMBA, Harvard University"
53,"Soy sauce, Self Made",,,"Foshan, China",China,,,
59,"Real estate management, Self Made",8,1,"Charleston, South Carolina",United States,Married,3,"Master of Business Administration, Harvard Business School; Bachelor of Science, University of Oklahoma"
71,"Apparel, Self Made",,,"Changshu, China",China,Married,1,"EMBA, Phoenix International University"
,Retail,,,,India,,3,
85,"Telecoms, media, oil-services, Self Made",,,"Kuala Lumpur, Malaysia",Malaysia,Married,3,"Master of Business Administration, Harvard University; Bachelor of Arts/Science, Melbourne University"
74,"Electronics, Self Made",,,"Taipei, Taiwan",Taiwan,Married,2,"Bachelor of Arts/Science, National Taiwan University"
82,Frozen foods,5,1,"Islamorada, Florida",United States,Married,4,"Master of Business Administration, Simon School of Business; Bachelor of Arts/Science, Williams College"
49,"Online gambling, Self Made",8,,"Isle of Man, United Kingdom",Canada,Single,,"Drop Out, Fanshawe College"
74,"Microsoft, Self Made",6,2,"Medina, Washington",United States,Married,2,"Doctorate, Stanford University; Bachelor of Arts/Science, University of California, Berkeley"
78,"Plush toys, real estate, Self Made",10,2,"Oak Brook, Illinois",United States,Single,,"Drop Out, Kalamazoo College"
,"Real estate, private equity, Self Made",8,3,,United States,,3,"Bachelor of Arts/Science, University of Michigan; Doctor of Jurisprudence, University of Michigan"
49,"Steel, Self Made",,,"Beijing, China",China,Married,,
59,Investments,,,"Mumbai, India",India,Widowed,3,"Bachelor of Commerce, University of Mumbai"
90,Franklin Templeton,5,3,"Palm Beach, Florida",United States,Married,6,"Bachelor of Arts/Science, Yale University"
49,"Online games, Self Made",,,"Seoul, South Korea",South Korea,Separated,2,"Bachelor of Arts/Science, Sogang University"
62,"Private equity, Self Made",8,1,"Miami Beach, Florida",United States,,,"Bachelor of Arts/Economics, Columbia University; Master of Business Administration, Harvard Business School; Doctor of Jurisprudence, Harvard University"
64,"Shipping, seafood, Self Made",,,"Vettre, Norway",Norway,Married,4,
65,"Private equity, Self Made",8,,"New York, New York",United States,Married,4,"Master of Business Administration, Harvard Business School; Bachelor of Arts/Science, Rutgers University; Master of Science in Engineering, Stanford University"
71,"Pharmaceuticals, Self Made",,,"Hong Kong, Hong Kong",China,Married,2,
76,"Software, Self Made",8,2,"Palo Alto, California",United States,Married,1,"Doctorate, Carnegie Mellon University; Master of Science, Carnegie Mellon University; Bachelor of Arts/Science, Indian Institute of Technology, Bombay"
88,"Medical devices, Self Made",,,"Wilson, Wyoming",Switzerland,Divorced,1,"Master of Business Administration, Harvard University; Master of Science, Swiss Federal Institute of Technology"
72,San Francisco 49ers,3,1,"Youngstown, Ohio",United States,Married,4,
80,"Money management, Self Made",8,1,"New York, New York",United States,Married,2,"Bachelor of Arts/Science, Bucknell University"
75,"Oil, investments",4,2,"Fort Worth, Texas",United States,Married,4,"Master of Business Administration, Stanford University; Bachelor of Arts/Science, Yale University"
55,Biotech and investments,,,"Gstaad, Switzerland",Switzerland,,,
43,"Trading, Self Made",,,"London, United Kingdom",United Kingdom,Married,,"Master of Science, Moscow State University; Ph.D, Moscow State University; Master of Economics, New Economic School"
69,"Software, investments",,,"Zurich, Switzerland",Switzerland,Married,,
57,"Telecom, Self Made",8,3,"Boston, Massachusetts",United States,Married,,"Bachelor of Arts/Science, Connecticut College"
50,"Pharmaceuticals, Self Made",,,"Moscow, Russia",Russia,Married,2,"Bachelor of Arts/Science, Novosibirsk State University"
57,"Online services, Self Made",,,"Seoul, South Korea",South Korea,Married,2,"Bachelor of Science in Engineering, Seoul National University; Master of Science, Seoul National University"
50,Estée Lauder,4,,"New York, New York",United States,Married,,"Bachelor of Arts/Science, Stanford University"
84,Sporting goods,,,"Lille, France",France,Married,4,
79,"Star Wars, Self Made",8,3,"San Anselmo, California",United States,Married,4,"Bachelor of Arts/Science, University of Southern California"
86,"Energy, sports",2,2,"Houston, Texas",United States,Widowed,4,"Bachelor of Arts/Science, Columbia College"
57,"Biotechnology, Self Made",,,"Mainz, Germany",Germany,Married,,
65,Real estate,,,"Munich, Germany",Germany,Widowed,3,
60,Dental implants,,,"Basel, Switzerland",Switzerland,,,
64,Food,,,"Istanbul, Turkey",Turkey,Married,3,"Bachelor of Arts/Science, Bogazici University"
66,"Lululemon, Self Made",,,"Vancouver, Canada",Canada,Married,5,"Bachelor of Arts/Science, University of Calgary"
,Real estate,,,"Beijing, China",China,Widowed,,
80,"New Balance, Self Made",8,2,"Newton, Massachusetts",United States,Married,2,"Bachelor of Arts/Science, Middlebury College"
72,"Pharmaceuticals, Self Made",,,"Hyderabad, India",India,Married,2,
82,Dolby Laboratories,1,3,"San Francisco, California",United States,Widowed,2,"Bachelor of Arts/Science, Heidelberg University"
,"E-commerce, Self Made",8,,"Buenos Aires, Argentina",Argentina,,,"Master of Business Administration, Stanford Graduate School of Business; Bachelor of Arts/Science, University of Pennsylvania, The Wharton School"
81,"Payroll services, Self Made",9,2,"Naples, Florida",United States,Married,2,"Associate in Arts/Science, SUNY Tech Alfred"
53,"Investments, Self Made",6,2,"New York, New York",United States,Married,,"Bachelor of Arts/Science, University of Pennsylvania, The Wharton School"
67,"Investments, Self Made",,,"Tbilisi, Georgia",Georgia,Married,4,
94,"Palm oil, nickel mining, Self Made",,,"Jakarta, Indonesia",Indonesia,Married,7,
77,"Medical devices, Self Made",,,"Binningen, Switzerland",Switzerland,Married,2,"Master of Business Administration, INSEAD"
86,Cheese,,,"Montreal, Canada",Canada,Married,3,"Diploma, High School"
72,U-Haul,5,,"Phoenix, Arizona",United States,Married,1,"Bachelor of Arts/Science, College of the Holy Cross"
58,"Washington Commanders, Self Made",8,1,"Potomac, Maryland",United States,Married,3,"Drop Out, University of Maryland"
61,"Diversified, Self Made",,,"Jakarta, Indonesia",Indonesia,Married,2,"Medical Doctor, University of Indonesia"
67,"Pipelines, Self Made",9,2,"Dallas, Texas",United States,Married,1,"Bachelor of Arts/Science, University of Texas Arlington"
50,"E-commerce, Self Made",,,"Beijing, China",China,,,"Master of Business Administration, The Wharton School of the University of Pennsylvania"
58,"Sports retailing, Self Made",,,"Hertfordshire, United Kingdom",United Kingdom,Divorced,,
50,"Supermarkets, Self Made",,,"Krotoszyn,, Poland",Poland,,,
79,"Hospitals, Self Made",,,"Koenigstein, Germany",Germany,Married,3,"Master of Business Administration, Harvard University"
69,"Gas stations, retail",3,2,"Knoxville, Tennessee",United States,Married,3,"Bachelor of Arts/Science, University of Tennessee Knoxville"
65,Cleaning products,3,2,"Racine, Wisconsin",United States,Divorced,1,"Bachelor of Arts/Science, Cornell University; Doctorate, Cornell University; Master of Science, Cornell University; Master of Business Administration, Samuel Curtis Johnson Graduate School of Management"
68,Cleaning products,1,2,"Racine, Wisconsin",United States,Married,4,"Bachelor of Arts/Science, Cornell University; Master of Business Administration, Kellogg School of Management"
66,Cleaning products,3,2,"Racine, Wisconsin",United States,Married,5,"Bachelor of Arts/Science, Cornell University"
68,"Venture capital, Self Made",,,,,,,
64,"IT provider, Self Made",9,1,"Austin, Texas",United States,Divorced,2,"Bachelor of Arts/Science, Amherst College; Master of Business Administration, Harvard Business School"
64,Cleaning products,2,2,"Virginia Beach, Virginia",United States,Married,4,"Drop Out, Cornell University"
70,Pharmaceuticals,,,"Ahmedabad, India",India,Married,2,"Bachelor of Arts/Science, Gujarat University; Master of Science, Gujarat University"
78,"Manufacturing, Self Made",,,"Hong Kong, Hong Kong",Germany,Married,1,"Master of Science in Engineering, Technical College in Flensburg"
62,"Mining, Self Made",,,"Shanghai, China",China,Married,,
88,"Energy, investments",,,"Grijo, Portugal",Portugal,Widowed,3,
76,New Orleans Saints,1,2,"New Orleans, Louisiana",United States,Widowed,,"High School Graduate, High School"
79,"Electronics, Self Made",,,"Taipei, Taiwan",Singapore,Married,3,"Bachelor of Arts/Science, National Taiwan University"
63,"Carpet, Self Made",,,"Istanbul, Turkey",Turkey,Married,3,
55,"Banking, Self Made",,,"Sao paulo, Brazil",Brazil,Married,3,"Bachelor of Arts/Science, Universidade Federal do Rio de Janeiro"
68,Real estate,,,"Toronto, Canada",Canada,,,
78,Samsung,,,"Seoul, South Korea",South Korea,Widowed,3,"Bachelor of Arts/Science, Seoul National University"
51,"Hair dryers, Self Made",,,"Shanghai, China",China,Married,,
69,"Bloomberg LP, Self Made",8,2,"Croton-on-Hudson, New York",United States,Married,2,"Bachelor of Arts/Science, SUNY Binghamton"
76,"Aluminum, diversified, Self Made",,,"Longkou, China",China,Married,2,
52,"Video games, Self Made",8,1,"Cary, North Carolina",United States,,,"Bachelor of Arts/Science, University of Maryland, College Park"
61,"Vodka, Self Made",8,,"Austin, Texas",United States,Married,3,"Bachelor of Arts/Science, University of Texas at Austin"
65,"Online media, Dallas Mavericks, Self Made",8,1,"Dallas, Texas",United States,Married,3,"Bachelor of Arts/Science, Indiana University"
96,"Cable television, Self Made",9,2,"Oyster Bay, New York",United States,Married,6,"Drop Out, John Carroll University"
46,"Twitter, Square, Self Made",8,3,"San Francisco, California",United States,Single,,"Drop Out, New York University"
56,"Petrochemicals, Self Made",,,"Wujiang, China",China,Married,1,
62,"Mining, Self Made",,,"Almaty, Kazakhstan",Kazakhstan,Married,3,
56,Financial services,,,"Taipei, Taiwan",Taiwan,Married,2,"Master of Business Administration, Leonard N. Stern School of Business; Bachelor of Arts/Science, New York University"
79,Estee Lauder,5,3,"New York, New York",United States,Married,2,"Bachelor of Arts/Science, University of Pennsylvania, The Wharton School"
54,"Renewable energy, Self Made",,,"Fushun, China",China,,,
45,"Gaming, Self Made",,,"Singapore, Singapore",Singapore,Married,,"Bachelor of Engineering, Shanghai Jiaotong University; Master of Business Administration, Stanford Graduate School of Business"
56,Telecom,,,"Hong Kong, Hong Kong",Hong Kong,Single,3,"Drop Out, Stanford University"
69,Supermarkets,3,2,"Grand Rapids, Michigan",United States,Divorced,1,
71,Supermarkets,3,2,"Grand Rapids, Michigan",United States,Married,3,
65,Supermarkets,3,2,"Grand Rapids, Michigan",United States,,,
79,"Food, Self Made",,,"Algiers, Algeria",Algeria,Married,5,
79,"FedEx, Self Made",9,1,"Memphis, Tennessee",United States,Married,10,"Bachelor of Arts/Science, Yale University"
62,"Private equity, Self Made",8,1,"Miami, Florida",United States,Divorced,3,"Bachelor of Arts/Science, Brown University"
34,"Heating, cooling equipment",,,"Battenberg, Germany",Germany,,,
53,"Energy drinks, Self Made",8,1,"Delray Beach, Florida",United States,Single,,"Bachelor of Arts/Science, San Diego State University"
66,"Healthcare, Self Made",,,"Wuhan, China",China,,,
56,Tequila,,,Mexico,Mexico,,,
83,"Software, Self Made",,,"Walldorf, Germany",Germany,Married,2,"Master of Science, University of Karlsruhe"
56,"Acoustic components, Self Made",,,"Weifang, China",China,Married,1,"Bachelor of Arts/Science, Beijing University of Aeronautics and Astronautics; Master of Business Administration, Tsinghua University"
55,"Software, Self Made",7,,"Austin, Texas",United States,Single,,"Drop Out, Stanford University"
83,Dairy,,,"Zurich, Switzerland",Germany,In Relationship,9,
77,"Software services, Self Made",,,"Bangalore, India",India,Married,2,"Master of Science, Indian Institute of Technology"
71,"Retail, real estate",,,"Trondheim, Norway",Norway,Married,2,
61,"Private equity, Self Made",8,2,"New York, New York",United States,Married,,"Bachelor of Arts/Science, University of Pennsylvania; Master of Business Administration, University of Pennsylvania, The Wharton School"
70,"Real estate, Self Made",,,"Dubai, United Arab Emirates",United Arab Emirates,Married,4,"Bachelor of Arts/Science, University of Washington"
41,"Fintech, Self Made",,,"Sao Paulo, Brazil",Colombia,Married,,"Master of Business Administration, Stanford Graduate School of Business; Bachelor of Science, Stanford University"
59,"Chemicals, Self Made",,,"Guangzhou, China",China,,,
73,Retail,,,"Taipei, Taiwan",Taiwan,Married,2,"Bachelor of Arts/Science, Chinese Culture University; Ph.D, National Chengchi University; Master of Business Administration, National Taiwan University"
65,"Chemicals, spandex, Self Made",,,"Wenzhou, China",China,Married,2,
51,"Biotech, vaccines, Self Made",,,"Boston, Massachusetts",France,Married,2,"Master of Science in Engineering, Ecole Centrale Paris; Master of Business Administration, Harvard University; Master of Science in Engineering, University of Minnesota"
89,"Computer services, real estate",1,2,"Dallas, Texas",United States,Widowed,5,"Bachelor of Arts/Science, Goucher College"
88,"Defense, Self Made",7,,"San Diego, California",United States,Widowed,,"Bachelor of Arts/Science, Yale University"
63,"Staffing & recruiting, Self Made",8,2,"Cockeysville, Maryland",United States,Married,2,"Bachelor of Arts/Science, Villanova University"
65,Construction,,,"Madrid, Spain",Spain,Divorced,6,"Master of Business Administration, MIT Sloan School of Management; Bachelor of Arts/Science, Universidad  Politecnica de Madrid"
81,"Biochemicals, Self Made",,,"Liestal, Switzerland",Switzerland,,,
59,Retail,,,"Munich, Germany",Germany,Married,4,
67,"Real estate, Self Made",,,"Mumbai, India",India,Married,2,
71,Philadelphia Eagles,4,2,"Wynnewood, Pennsylvania",United States,Married,2,"Doctorate, Brandeis University; Bachelor of Arts/Science, Clark University"
66,"Investment research, Self Made",8,2,"Chicago, Illinois",United States,Married,3,"Bachelor of Arts/Science, University of Chicago"
65,"Home-cleaning robots, Self Made",,,"Suzhou, China",China,Married,1,"Master of Philosophy, Nanjing University"
55,"Titanium, Self Made",,,"Moscow, Russia",Russia,,,"Master of Science, Moscow Institute of Physics and Technology"
60,"Telecom, Self Made",,,"Zermatt, Switzerland",France,Married,4,
47,"Private equity, Self Made",8,,"Los Angeles, California",United States,Married,,"Bachelor of Business Administration, University of California, Berkeley"
64,"Banking, Self Made",,,"A Coruña, Spain",Venezuela,Married,4,"Master, University of Miami"
50,"Private equity, Self Made",8,1,"Los Angeles, California",United States,Married,,"Bachelor of Engineering, Princeton University; Master of Business Administration, Stanford University"
61,"Pharmaceuticals, Self Made",,,"Beijing, China",China,,,
91,"Trucking, Self Made",7,2,"Fayetteville, Arkansas",United States,Widowed,2,"Drop Out, University of Central Arkansas"
90,"Little Caesars Pizza, Self Made",9,2,"Bingham Farms, Michigan",United States,Widowed,7,"Diploma, High School; High School Graduate, High School"
61,"Pharmacies, Self Made",,,"Edmonton, Canada",Canada,Married,2,"Bachelor of Arts/Science, University of Alberta; Doctor of Jurisprudence, University of Alberta"
63,"Metals, Self Made",,,"Verkhniaya Pyshma, Russia",Russia,Married,1,"Master of Science in Engineering, Ural Polytechnic Institute"
56,"Banking, Self Made",,,"Almaty, Kazakhstan",Kazakhstan,Married,3,"Bachelor of Arts/Science, Moscow State University"
56,Banking,,,"Almaty, Kazakhstan",Kazakhstan,Married,3,"Doctorate in Pedagogical Sciences, State Institute of Theatre Arts (GITIS, Moscow)"
61,"Real estate, Self Made",,,,United Kingdom,,,
58,"Real estate, Self Made",,,,United Kingdom,,,
61,Cargill,1,1,"Rancho Santa Fe, California",United States,Divorced,2,
76,"Real estate, Self Made",8,,"San Francisco, California",United States,Married,,"Bachelor of Arts/Science, Boston University"
55,"Diversified, Self Made",,,"Hanoi, Vietnam",Vietnam,Married,3,
65,Medical equipment,1,4,"New York, New York",United States,Married,2,"Bachelor of Arts/Science, Kalamazoo College; Master of Architecture, University of California, Berkeley"
67,Finance,,,"Taipei, Taiwan",Taiwan,Married,4,"LLM, Georgetown University; LLB, National Taiwan University"
66,Finance,,,"Taipei, Taiwan",Taiwan,Married,2,"Master of Business Administration, Leonard N. Stern School of Business; Graduate, National Taiwan University"
42,"Drones, Self Made",,,"Shenzhen, China",China,Married,,"Bachelor of Arts/Science, Hong Kong University of Science and Technology; Master of Science, Hong Kong University of Science and Technology"
74,"Solar inverters, Self Made",,,"Ningbo, China",China,Married,1,
58,"Business software, Self Made",,,"Beijing, China",China,Married,1,"Bachelor of Arts/Science, Jiangxi University of Finance & Economics"
84,"Investments, Self Made",10,1,"Coral Gables, Florida",United States,Married,,"Associate in Arts/Science, Brevard Community College; Bachelor of Arts/Science, Southern College of Optometry; Doctorate, Southern College of Optometry"
65,Carnival Cruises,,,"Tel Aviv, Israel",Israel,Divorced,4,"Drop Out, Miami Dade College"
68,"Oil, banking, telecom, Self Made",,,Latvia,Russia,Married,3,"Ph.D, Moscow State University"
82,"Real estate, Self Made",,,"Beijing, China",China,Married,3,"Doctorate, Savannah College of Art and Design"
