Age,Source of Wealth,Self-Made Score,Philanthropy Score,Residence,Citizenship,Marital Status,Children,Education
74,LVMH,,,"Paris, France",France,Married,5,"Bachelor of Arts/Science, Ecole Polytechnique de Paris"
52,"Tesla, SpaceX, Self Made",8,1,"Austin, Texas",United States,Single,10,"Bachelor of Arts/Science, University of Pennsylvania"
59,"Amazon, Self Made",8,2,"Medina, Washington",United States,Engaged,4,"Bachelor of Arts/Science, Princeton University"
79,"Oracle, Self Made",9,1,"Lanai, Hawaii",United States,In Relationship,4,"Drop Out, University of Chicago; Drop Out, University of Illinois, Urbana-Champaign"
92,"Berkshire Hathaway, Self Made",8,5,"Omaha, Nebraska",United States,"Widowed, Remarried",3,"Master of Science, Columbia University; Bachelor of Arts/Science, University of Nebraska Lincoln"
67,"Microsoft, Self Made",8,5,"Medina, Washington",United States,Divorced,3,"Drop Out, Harvard University"
81,"Bloomberg LP, Self Made",8,4,"New York, New York",United States,In Relationship,2,"Master of Business Administration, Harvard Business School; Bachelor of Arts/Science, Johns Hopkins University"
83,"Telecom, Self Made",,,"Mexico City, Mexico",Mexico,Widowed,6,"Bachelor of Arts/Science, Universidad Nacional Autonoma de Mexico"
66,Diversified,,,"Mumbai, India",India,Married,3,"Drop Out, Stanford University; Bachelor of Science in Engineering, University of Mumbai"
67,"Microsoft, Self Made",6,2,"Hunts Point, Washington",United States,Married,3,"Bachelor of Arts/Science, Harvard University; Drop Out, Stanford University"
70,L'Oréal,,,"Paris, France",France,Married,2,
50,"Google, Self Made",8,1,"Palo Alto, California",United States,Married,1,"Master of Science, Stanford University; Bachelor of Arts/Science, University of Michigan"
87,"Zara, Self Made",,,"La Coruna, Spain",Spain,Married,3,
50,"Google, Self Made",9,2,"Los Altos, California",United States,Separated,3,"Master of Science, Stanford University; Bachelor of Arts/Science, University of Maryland, College Park"
68,"Beverages, pharmaceuticals, Self Made",,,"Hangzhou, China",China,,1,
39,"Facebook, Self Made",8,3,"Palo Alto, California",United States,Married,3,"Drop Out, Harvard University"
87,Koch Industries,5,2,"Wichita, Kansas",United States,Married,2,"Bachelor of Arts/Science, Massachusetts Institute of Technology; Master of Science, Massachusetts Institute of Technology"
61,Koch Industries,1,2,"New York, New York",United States,Widowed,3,"Bachelor of Arts/Science, University of Central Arkansas"
75,Walmart,2,1,"Bentonville, Arkansas",United States,Married,4,"Bachelor of Arts/Science, University of Arkansas"
78,Walmart,4,1,"Bentonville, Arkansas",United States,Married,3,"Doctor of Jurisprudence, Columbia University; Bachelor of Arts/Science, University of Arkansas"
73,Walmart,1,2,"Fort Worth, Texas",United States,Divorced,,"Bachelor of Arts/Science, Trinity University"
66,Media,,,"Toronto, Canada",Canada,Divorced,4,"Master of Arts, University of Cambridge"
58,"Dell Technologies, Self Made",8,2,"Austin, Texas",United States,Married,4,"Drop Out, The University of Texas at Austin"
61,"Infrastructure, commodities, Self Made",,,"Ahmedabad, India",India,Married,2,
85,"Nike, Self Made",8,3,"Hillsboro, Oregon",United States,Married,3,"Master of Business Administration, Stanford Graduate School of Business; Bachelor of Arts/Science, University of Oregon"
39,"TikTok, Self Made",,,"Beijing, China",China,,,"Bachelor of Engineering, Nankai University"
83,Retail,,,"Neckarsulm, Germany",Germany,Married,2,
87,"Luxury goods, Self Made",,,"Paris, France",France,Married,3,"Drop Out, High School"
86,Shipping,,,"Schindellegi, Switzerland",Germany,Married,,
58,"Nutella, chocolates",4,,"Brussels, Belgium",Italy,Married,2,
83,"Candy, pet food",2,,"The Plains, Virginia",United States,Divorced,3,"Bachelor of Arts/Science, Bryn Mawr College"
87,"Candy, pet food",2,,"Jackson, Wyoming",United States,Married,3,"Diploma, The Hotchkiss School; Bachelor of Arts/Science, Yale University"
95,"Diversified, Self Made",,,Hong Kong,Hong Kong,Widowed,2,"Drop Out, High School"
51,"Internet media, Self Made",,,"Shenzhen, China",China,Married,,"Bachelor of Arts/Science, Shenzhen University"
77,Casinos,2,2,"Las Vegas, Nevada",United States,Widowed,5,"Bachelor of Science, Hebrew University Jerusalem"
54,"Hedge funds, Self Made",8,1,"Miami, Florida",United States,Divorced,3,"Bachelor of Arts/Science, Harvard University"
31,Red Bull,,,"Salzburg, Austria",Austria,Single,,
54,"Batteries, Self Made",,,"Ningde, China",Hong Kong,,,"Doctorate, Chinese Academy of Social Sciences"
74,"Fashion retail, Self Made",,,"Tokyo, Japan",Japan,Married,2,"Bachelor of Arts/Science, Waseda University"
66,"Music, chemicals, Self Made",9,2,"London, United Kingdom",United States,Married,,"Master of Science, Columbia University; Master of Business Administration, Harvard Business School; Bachelor of Arts/Science, Moscow State University"
74,Chanel,,,"New York, New York",France,Married,3,
72,Chanel,,,"New York, New York",France,Married,2,
83,"Shipping, Self Made",,,"Geneva, Switzerland",Switzerland,Married,2,
78,"Shipping, Self Made",,,"Geneva, Switzerland",Switzerland,Married,2,
43,"E-commerce, Self Made",,,"Shanghai, China",China,,,"Master, University of Wisconsin Madison; Bachelor of Arts/Science, Zhejiang University"
88,"Fasteners, Self Made",,,"Kuenzelsau, Germany",Germany,Married,3,
95,"Real estate, Self Made",,,"Hong Kong, Hong Kong",Hong Kong,Divorced,5,
65,"Trading, investments, Self Made",8,1,"Haverford, Pennsylvania",United States,Married,4,"Bachelor of Science, SUNY Binghamton"
85,"Hedge funds, Self Made",8,4,"East Setauket, New York",United States,Married,3,"Bachelor of Arts/Science, Massachusetts Institute of Technology; Doctorate, University of California, Berkeley"
76,"Investments, Self Made",8,2,"New York, New York",United States,Married,3,"Master of Business Administration, Harvard Business School; Bachelor of Arts/Science, Yale University"
61,"BMW, pharmaceuticals",,,"Bad Homburg, Germany",Germany,Married,3,"Master of Business Administration, International Institute for Management and Development"
69,Mining,,,"Perth, Australia",Australia,Widowed,4,
51,"Online games, Self Made",,,"Hangzhou, China",China,,,"Bachelor of Arts/Science, University of Electronic Science and Technology of China"
69,Mining,,,"Mexico City, Mexico",Mexico,Married,,
78,"software services, Self Made",,,"Delhi, India",India,Married,1,"Bachelor of Arts/Science, PSG College of Technology"
75,"Coal, Self Made",,,"Jakarta, Indonesia",Indonesia,Married,2,
78,"Discount brokerage, Self Made",10,1,"Palm Beach, Florida",United States,Divorced,3,"Drop Out, New York University"
51,"Fertilizers, coal, Self Made",,,"Ras Al Khaimah, United Arab Emirates",Russia,Married,2,"Master of Science, Plekhanov Russian University of Economics"
57,BMW,,,"Frankfurt, Germany",Germany,Married,1,"Associate in Arts/Science, Technical University of Karlsruhe"
53,Amazon,3,5,"Seattle, Washington",United States,Divorced,4,"Bachelor of Arts/Science, Princeton University"
82,"Banking, tobacco",,,"Kudus, Indonesia",Indonesia,Married,3,
62,"Metals, Self Made",,,"Moscow, Russia",Russia,Married,7,"Masters in Finance, Moscow Institute of International Relations"
58,"E-commerce, Self Made",,,"Hangzhou, China",China,Married,,"Bachelor of Arts/Science, Hangzhou Teacher's Institute"
81,"Home appliances, Self Made",,,"Foshan, China",China,Married,3,
80,Mining,,,"Santiago, Chile",Chile,Widowed,3,
83,"Banking, tobacco",,,"Kudus, Indonesia",Indonesia,Married,4,
70,"Chemicals, Self Made",,,"London, United Kingdom",United Kingdom,Married,,
82,Vaccines,,,"Pune, India",India,Widowed,1,"Bachelor of Arts/Science, Pune University; Doctorate, Pune University"
66,"telecom, investments, Self Made",,,"Tokyo, Japan",Japan,Married,2,"Bachelor of Arts/Science, University of California, Berkeley"
67,"Steel, transport, Self Made",,,"Moscow, Russia",Russia,Married,3,"Doctorate, Russian Academy of Economics; Bachelor of Arts/Science, Siberian Metallurgical Institute"
52,Cheese,,,"Laval, France",France,,,
61,Fidelity,4,1,"Milton, Massachusetts",United States,Married,2,"Master of Business Administration, Harvard Business School; Bachelor of Arts/Science, Hobart and William Smith"
68,"Gas, chemicals, Self Made",,,"Moscow, Russia",Russia,Married,2,"Master of Science in Engineering, Kuybyshev Engineering and Construction Institute"
36,Walmart,1,1,"Chicago, Illinois",United States,Married,,"Bachelor of Arts/Science, Colorado College"
52,"Package delivery, Self Made",,,"Shenzhen, China",China,,,
60,"Semiconductors, Self Made",8,1,"Los Altos, California",United States,Married,,"Bachelor of Science in Engineering, Oregon State University; Master of Science in Engineering, Stanford University"
90,Estee Lauder,5,3,"New York, New York",United States,"Widowed, Remarried",2,"Bachelor of Arts/Science, University of Pennsylvania"
78,"Sensors, Self Made",,,"Osaka, Japan",Japan,Married,,
57,"Steel, investments, Self Made",,,"Moscow, Russia",Russia,Married,7,"Master of Science in Engineering, Leningrad Institute of Economics; Master of Business Administration, University of Northumbria"
72,"Oil, Self Made",,,"Moscow, Russia",Russia,Married,1,"Master of Science in Engineering, Azerbaijan Institute of Oil and Chemistry"
85,"Hospitals, Self Made",7,1,"Nashville, Tennessee",United States,Married,3,"Bachelor of Arts/Science, Vanderbilt University; Medical Doctor, Washington University"
61,"Mining, Self Made",,,"Perth, Australia",Australia,Separated,3,"Bachelor of Arts/Science, University of Western Australia; Ph.D, University of Western Australia"
74,"Hedge funds, Self Made",8,3,"Greenwich, Connecticut",United States,Married,4,"Master of Business Administration, Harvard Business School; Bachelor of Arts/Science, Long Island University"
60,"Automobiles, Self Made",,,"Hangzhou, China",China,Married,2,"Master of Science, Yanshan University"
55,"Mining, copper products, Self Made",,,"Shenzhen, China",China,,,
73,"Real estate, shipping",,,"Monte Carlo, Monaco",Israel,Married,4,
58,"Pig breeding, Self Made",,,"Nanyang, China",China,Married,1,
57,"Batteries, automobiles, Self Made",,,"Shenzhen, China",China,Married,,"Master of Science, Beijing Non-Ferrous Research Institute; Bachelor of Arts/Science, Central South Industrial University of Technology"
77,"Oil & gas, Self Made",10,1,"Oklahoma City, Oklahoma",United States,Divorced,5,"Diploma, High School"
65,"Hedge funds, Self Made",8,2,"Palm Beach, Florida",United States,Married,3,"Master of Business Administration, David A. Tepper School of Business; Bachelor of Arts/Science, University of Pittsburgh"
70,"Oil, gas, Self Made",,,"Moscow, Russia",Russia,Married,3,"Master of Science in Engineering, Leningrad Mechanical Institute"
61,"Quicken Loans, Self Made",8,1,"Franklin, Michigan",United States,Married,5,"Bachelor of Arts/Science, Michigan State University; LLB, Wayne State University"
73,Steel,,,"London, United Kingdom",India,Married,2,"Bachelor of Arts/Science, St Xavier's College Calcutta"
67,"Hedge funds, Self Made",8,3,"Greenwich, Connecticut",United States,Married,7,"Bachelor of Arts/Science, University of Pennsylvania, The Wharton School"
87,"Investments, Self Made",9,2,"Indian Creek, Florida",United States,Married,2,"Drop Out, New York University; Bachelor of Arts/Science, Princeton University"
73,Steel,,,"Hisar, India",India,Widowed,9,
91,"Real estate, Self Made",8,4,"Newport Beach, California",United States,Married,7,"Bachelor of Arts/Science, University of Washington"
83,"Home improvement stores, Self Made",9,1,"Eau Claire, Wisconsin",United States,Married,6,"Bachelor of Arts/Science, University of Wisconsin, Eau Claire"
92,"Newspapers, TV network",5,1,"New York, New York",United States,Married,6,"Bachelor of Arts/Science, Oxford University; Master of Arts, Oxford University"
70,Banking,,,"Crans-Montana, Switzerland",Brazil,Widowed,4,
72,"Aldi, Trader Joe's",,,"Mulheim an der Ruhr, Germany",Germany,,1,
56,"Finance, telecommunications",,,"Prague, Czech Republic",Czech Republic,Widowed,4,
72,"medical devices, Self Made",,,"Shenzhen, China",Singapore,,,"Bachelor of Science, University of Science and Technology of China"
75,H&M,,,"Stockholm, Sweden",Sweden,Married,3,"Associate in Arts/Science, University of Stockholm"
68,"Google, Self Made",6,2,"Atherton, California",United States,Married,2,"Bachelor of Arts/Science, Princeton University; Doctorate, University of California, Berkeley; Master of Science, University of California, Berkeley"
55,"Hedge funds, Self Made",,,"Geneva, Switzerland",United Kingdom,,,"Bachelor of Arts/Science, London School of Economics; Bachelor of Arts/Science, London School of Economics"
67,"Soy sauce, Self Made",,,"Foshan, China",China,,,
,Supermarkets,,,Germany,Germany,,,
,Supermarkets,,,,Germany,,,
84,"Beer, Self Made",,,"Zurich, Switzerland",Brazil,Married,5,"Bachelor of Arts/Science, Harvard University"
76,Real estate,,,"Hong Kong, Hong Kong",Hong Kong,Married,3,"Master of Business Administration, Columbia Business School"
67,"Pharmaceuticals, Self Made",,,"Mumbai, India",India,Married,2,"Bachelor of Arts/Science, Calcutta University"
45,"Wireless networking, Self Made",8,1,"San Jose, California",United States,Single,,"Bachelor of Arts/Science, University of California, San Diego; Master of Science, University of California, San Diego"
68,"Retail, investments, Self Made",,,"Mumbai, India",India,Married,3,
56,"Batteries, Self Made",,,"Ningde, China",China,,,"Bachelor of Technology, Hefei University of Technology"
84,Diversified,,,"Bangkok, Thailand",Thailand,Widowed,5,
81,"Retail, Self Made",10,2,"Oklahoma City, Oklahoma",United States,Married,3,"Diploma, High School"
79,"Alcohol, real estate, Self Made",,,"Bangkok, Thailand",Thailand,Widowed,5,
69,Heineken,,,"London, United Kingdom",Netherlands,Married,5,"Bachelor of Arts/Science, Rijnlands Lyceum Wassenaar; Doctor of Jurisprudence, University of Leiden"
61,"Medical devices, Self Made",,,"Shenzhen, China",Hong Kong,,,"EMBA, Ceibs; Bachelor of Engineering, Tsinghua University; Master of Science in Engineering, Tsinghua University"
59,"Automobiles, Self Made",,,"Baoding, China",China,Married,,"Bachelor of Arts/Science, Hebei Province"
69,"Steel, telecom, investments, Self Made",,,"Tashkent, Uzbekistan",Russia,Divorced,,"Master, Finance Academy under the Government of the Russian Federation; Master of Laws, Moscow Institute of International Relations"
96,"Paints, Self Made",,,"Singapore, Singapore",Singapore,Widowed,3,
56,Commodities,,,"Mumbai, India",India,Married,3,"Master of Business Administration, London Business School; Bachelor of Arts/Science, University of Mumbai"
66,"Cement, sugar, Self Made",,,"Lagos, Nigeria",Nigeria,Divorced,3,"Bachelor of Arts/Science, Al-Azhar University"
93,Real estate,,,"Hong Kong, Hong Kong",Hong Kong,Widowed,4,
67,Shipping,,,"London, United Kingdom",Israel,Married,5,
57,"Hospitals, Self Made",,,"Changsha, China",China,Married,,"Master of Business Administration, Hunan University"
94,"Casinos/hotels, Self Made",,,"Hong Kong, Hong Kong",Hong Kong,Married,5,
78,"Shipping, Self Made",,,"London, United Kingdom",Cyprus,Widowed,2,
76,"Building supplies, Self Made",9,1,"Afton, Wisconsin",United States,Widowed,7,"Diploma, High School"
47,"WhatsApp, Self Made",10,2,"Atherton, California",United States,Single,,"Drop Out, San Jose State University"
80,"Dallas Cowboys, Self Made",8,1,"Dallas, Texas",United States,Married,3,"Bachelor of Arts/Science, University of Arkansas; Master of Arts, University of Arkansas"
81,"Oil & gas, banking",5,4,"Tulsa, Oklahoma",United States,Married,3,"Bachelor of Arts/Science, Harvard University; Master of Business Administration, Harvard University"
72,"Real estate, Self Made",,,"Hong Kong, Hong Kong",Hong Kong,Divorced,6,
60,"Automobiles, batteries, Self Made",,,"Guangzhou, China",China,Married,,
90,"Real estate, Self Made",,,"Sydney, Australia",Australia,Married,2,"Bachelor of Arts/Science, University of Leeds"
64,"Banking, Self Made",,,"Mumbai, India",India,Married,2,"Bachelor of Arts/Science, University of Mumbai; Master of Business Administration, University of Mumbai"
76,"Sports, real estate, Self Made",6,,"Electra, Texas",United States,Married,2,"Master of Business Administration, Robert J. Trulaske, Sr. College of Business; Bachelor of Arts/Science, University of Missouri"
59,"Oil, banking, telecom, Self Made",,,"London, United Kingdom",Russia,Divorced,5,"Master of Science, Moscow Institute of Steel and Alloys"
58,"energy, Self Made",,,"Bangkok, Thailand",Thailand,Married,,"Bachelor of Science in Engineering, Chulalongkorn University; Master of Science in Engineering, University of Southern California"
50,"Coal, Self Made",,,"Yinchuan, China",China,,,"Master of Business Administration, Peking University"
69,"Vaccines, Self Made",,,"Chongqing, China",China,Married,1,"Associate in Arts/Science, Guilin Medical University"
73,"Auto parts, Self Made",10,1,"Naples, Florida",United States,Married,2,"Bachelor of Arts/Science, University of Illinois, Urbana-Champaign"
59,"Apple, Disney",2,1,"Palo Alto, California",United States,Widowed,3,"Master of Business Administration, Stanford Graduate School of Business; Bachelor of Arts/Science, University of Pennsylvania, The Wharton School"
99,"Palm oil, shipping, property, Self Made",,,"Hong Kong, Hong Kong",Malaysia,Married,8,"Bachelor of Arts/Science, Raffles College"
83,"Real estate, Self Made",8,2,"New York, New York",United States,Married,4,"Master of Laws, New York University; Bachelor of Arts/Science, University of Michigan; Doctor of Jurisprudence, Wayne State University"
38,"Messaging app, Self Made",,,"Dubai, United Arab Emirates",United Arab Emirates,Single,2,"Master of Science, Saint Petersburg State University"
73,"Pharmaceuticals, Self Made",,,"Tegernsee, Germany",Germany,Married,2,"Medical Doctor, University at Buffalo"
73,"Pharmaceuticals, Self Made",,,"Tegernsee, Germany",Germany,Married,4,"Master of Business Administration, University of Augsburg; Master of Business Administration, University of Augsburg"
59,"Agribusiness, Self Made",,,"Chengdu, China",China,Married,,"Bachelor of Arts/Science, Sichuan University"
51,"Online retail, Self Made",8,1,"Bryn Mawr, Pennsylvania",United States,Divorced,1,"Drop Out, Villanova University"
74,"Hedge funds, Self Made",9,1,"New York, New York",United States,Married,3,"Bachelor of Arts/Science, New York University"
69,"Fertilizer, real estate, Self Made",,,"Herzliya, Israel",Russia,Married,5,"Ph.D, Moscow Aviation University"
63,Manufacturing,,,"Melbourne, Australia",Australia,,2,"Bachelor of Arts/Economics, Monash University"
58,"Investments, Self Made",,,"Frauenfeld, Switzerland",Russia,Single,,"Master of Economics, Moscow Institute of Finance"
89,"Luxury goods, Self Made",,,"Milan, Italy",Italy,Single,,"Drop Out, University of Piacenza"
73,Luxury goods,,,"Cape Town, South Africa",South Africa,Married,3,
58,"Video surveillance, Self Made",,,"Hong Kong, Hong Kong",Hong Kong,Married,2,"Bachelor of Arts/Science, Huazhong University of Science and Technology"
51,"Internet media, Self Made",,,"Shenzhen, China",China,,,"Bachelor of Arts/Science, Shenzhen University; Master of Arts, South China University of Technology"
83,"Energy, sports, entertainment",5,3,"Denver, Colorado",United States,Married,3,"Bachelor of Arts/Science, University of Kansas"
86,"Gas stations, Self Made",9,1,"Oklahoma City, Oklahoma",United States,Widowed,4,"Drop Out, St. John's University (MN); Bachelor of Arts/Science, University of Central Oklahoma"
67,"Retail, media",,,"Mexico City, Mexico",Mexico,Married,6,"Master of Business Administration, A. B. Freeman School of Business; Bachelor of Arts/Science, Tecnológico de Monterrey"
94,Media,5,2,"New York, New York",United States,Widowed,3,"Drop Out, Syracuse University"
82,"Manufacturing, New England Patriots, Self Made",8,3,"Brookline, Massachusetts",United States,"Widowed, Remarried",4,"Bachelor of Arts/Science, Columbia University; Master of Business Administration, Harvard Business School"
73,"Beer, Self Made",,,"Sao Paulo, Brazil",Brazil,Married,2,"Bachelor of Arts/Science, Universidade Federal do Rio de Janeiro"
57,"Gold, Self Made",,,"Moscow, Russia",Russia,Married,3,"Master of Economics, Dagestan State University"
39,"E-commerce, Self Made",,,"Guangzhou, China",China,,,"Bachelor of Science, Qingdao University"
45,"Cryptocurrency exchange, Self Made",,,"Dubai, United Arab Emirates",Canada,,,
70,"Banks, real estate, Self Made",8,1,"Dallas, Texas",United States,Divorced,6,"Drop Out, Baylor University"
43,"Software, Self Made",,,"Sydney, Australia",Australia,Married,4,"Bachelor of Arts/Science, University of New South Wales"
61,Medical devices,3,,"Bloomington, Indiana",United States,Married,,"Bachelor of Arts/Science, Purdue University; Master of Business Administration, Tippie School of Management"
82,"Business software, Self Made",8,3,"Incline Village, Nevada",United States,Married,10,"Bachelor of Engineering, Cornell University; Master of Business Administration, Samuel Curtis Johnson Graduate School of Management"
64,"Oil, Self Made",8,2,"Houston, Texas",United States,Married,3,"Bachelor of Arts/Science, The University of Texas at Austin; Master of Science, The University of Texas at Austin"
74,"Steel, Self Made",,,"Magnitogorsk, Russia",Russia,Married,2,"Master of Science in Engineering, Magnitogorsk Mining and Metallurgical Institute"
41,"Facebook, Self Made",,,"Singapore, Singapore",Brazil,Married,1,"Bachelor of Arts/Science, Harvard University"
58,Auto parts,,,"Herzogenaurach, Germany",Germany,Divorced,4,
74,Walmart,1,1,"Jackson, Wyoming",United States,Widowed,1,"High School Graduate, High School"
43,"Software, Self Made",,,"Sydney, Australia",Australia,Married,2,"Bachelor of Arts/Science, University of New South Wales"
82,"Banking, property",,,"Kuala Lumpur, Malaysia",Malaysia,Married,3,"LLB, Middle Temple"
59,"Real estate, Self Made",,,"Beijing, China",China,Divorced,1,"Bachelor of Engineering, Northwestern Polytechnical University"
85,"Oil, Self Made",9,,"Midland, Texas",United States,Married,2,"Master of Science, University of Texas, Austin"
75,"Diversified, Self Made",,,"Shanghai, China",China,Married,1,
74,"Infrastructure, commodities, Self Made",,,"Dubai, United Arab Emirates",Cyprus,Married,,
80,Hermes,,,"Martigny, Switzerland",France,,,
52,Shipping,,,"Marseille, France",France,,2,
53,Shipping,,,"Marseille, France",France,,,"Bachelor of Arts/Science, Concordia University"
55,Shipping,,,"Marseille, France",France,Married,1,
76,"Investments, Self Made",,,"Stockholm, Sweden",Sweden,Married,2,"Master of Business Administration, Gothenburg University"
63,"Fertilizers, Self Made",,,"Moscow, Russia",Russia,Married,2,"Master, Saint Petersburg Mining University; Bachelor of Arts/Science, State Central Institute of Physical Culture"
59,"Private equity, Self Made",7,1,"Seoul, South Korea",United States,Married,2,"Master of Business Administration, Harvard Business School; Bachelor of Arts/Science, Haverford College"
53,"Smartphones, Self Made",,,"Beijing, China",China,Married,2,"Bachelor of Science in Engineering, Wuhan University"
77,Manufacturing,,,"Haiger, Germany",Germany,Married,3,
64,"Pharmaceuticals, Self Made",,,"Lianyungang, China",China,Married,1,"Bachelor of Arts/Science, China Pharmaceutical University; Doctorate, Nanjing University"
71,Warehouse automation,5,,"Keene, New Hampshire",United States,Married,3,
70,"Solar panels, Self Made",,,"Xingtai, China",China,Married,2,"Associate in Arts/Science, Hebei Broadcast and Television University"
67,"Chemicals, Self Made",,,"Ningbo, China",China,Married,2,
59,"Candy, pet food",2,,"Los Angeles, California",United States,Divorced,,"Bachelor of Arts/Science, Duke University"
63,"Candy, pet food",2,,"Alexandria, Virginia",United States,Married,3,"Bachelor of Arts/Science, Vassar College"
64,"Candy, pet food",2,,"New York, New York",United States,Married,2,"Master of Business Administration, Columbia University; Bachelor of Arts/Science, Yale University"
66,"Candy, pet food",2,,"Philadelphia, Pennsylvania",United States,Married,4,"Master of Business Administration, University of Pennsylvania, The Wharton School; Bachelor of Arts/Science, Yale University"
71,Investments,,,"Paris, France",France,Married,4,"LLB, Universite Paris X Nanterre"
94,"Diversified, Self Made",,,"Vancouver, Canada",Canada,Married,3,
57,"Biotech, investments",,,"Gstaad, Switzerland",Switzerland,Divorced,3,"Bachelor of Arts/Science, Babson College; Master of Business Administration, Harvard University"
44,"E-commerce, Self Made",,,"Beijing, China",China,,,"Graduate, Tsinghua University"
41,"Airbnb, Self Made",8,1,"San Francisco, California",United States,Single,,"Bachelor of Arts/Science, Rhode Island School of Design"
76,"Vacuums, Self Made",,,"Gloucestershire, United Kingdom",United Kingdom,Married,3,
56,"Steel, investments, Self Made",,,"Moscow, Russia",Russia,Married,7,"Master, Moscow State Law Academy"
79,Diversified,,,"Stockholm, Sweden",Sweden,Married,4,"Master of Arts, University of Stockholm"
48,"Energy, investments, Self Made",,,"Prague, Czech Republic",Czech Republic,In Relationship,1,"Law Degree, Masaryk University"
82,"Cable television, Self Made",8,3,"Elizabeth, Colorado",United States,Married,2,"Doctorate, Johns Hopkins University; Master of Science, Johns Hopkins University; Bachelor of Arts/Science, Yale University"
78,Software services,,,"Bangalore, India",India,Married,2,"Bachelor of Arts/Science, Stanford University"
86,"Discount brokerage, Self Made",8,3,"Woodside, California",United States,Married,5,"Master of Business Administration, Stanford Graduate School of Business; Bachelor of Arts/Science, Stanford University"
63,"Hardware stores, Self Made",10,1,"Beverly Hills, California",United States,Married,,
