Age,Source of Wealth,Self-Made Score,Philanthropy Score,Residence,Citizenship,Marital Status,Children,Education
84,"Real estate, Self Made",8,2,"Palo Alto, California",United States,Married,4,"Bachelor of Arts/Science, Brigham Young University"
75,Pipe Manufacturing,,,,Italy,,,
70,Pipe Manufacturing,,,,Italy,,,
55,"Biotech investing, Self Made",,,"Delray Beach, Florida",United States,Married,3,"Master of Arts, George Washington University; Bachelor of Arts/Science, State University of New York at Binghamton"
68,"Facebook, Self Made",6,1,"Palo Alto, California",United States,Married,3,"Bachelor of Arts/Science, Vanderbilt University; Master of Science, Vanderbilt University"
63,"Technology services, Self Made",,,"Atlanta, Georgia",United States,Married,3,
,Publishing,,,,Germany,,,
76,Agrochemicals,,,"Delhi, India",India,Married,3,
55,"Real estate, airport, Self Made",,,"Moscow, Russia",Russia,Divorced,3,"Master of Science, Plekhanov Russian University of Economics"
33,"Snapchat, Self Made",8,2,"Los Angeles, California",United States,Married,3,"Bachelor of Science, Stanford University"
82,"Printing, Self Made",9,1,"Mankato, Minnesota",United States,Married,5,"Bachelor of Arts/Science, Minnesota State University"
53,"Movies, investments, Self Made",9,2,"Pittsburgh, Pennsylvania",United States,Married,,"Bachelor of Arts/Science, Hamilton College"
65,"Mining, banking, hotels, Self Made",,,"Nur-Sultan, Kazakhstan",Kazakhstan,Married,3,
30,Fish farming,,,"Kverva, Norway",Norway,Single,,
58,"Furniture, Self Made",,,"Hong Kong, Hong Kong",Hong Kong,Married,2,
61,"Medical equipment, Self Made",,,"Danyang, China",China,Married,1,"EMBA, China Europe International Business School"
59,"Pharmaceuticals, Self Made",,,"Chengdu, China",China,,,
53,"Real estate, Self Made",8,,"New York, New York",United States,Married,3,"Drop Out, Adelphi University"
54,"Biotech investing, Self Made",,,"New York, New York",United States,,,
57,"Investing, Self Made",,,"New York, New York",United States,,,
60,"Online games, Self Made",8,2,"San Francisco, California",United States,Married,4,"Bachelor of Arts/Science, Stanford University"
51,Beef processing,,,"Sao Paulo, Brazil",Brazil,Married,4,
50,Beef packing,,,"Sao Paulo, Brazil",Brazil,Married,3,
46,"Magazines, media",,,"Hamburg, Germany",Germany,Married,,
48,Chemicals,,,"Rheinfelden, Switzerland",Switzerland,Married,,
59,"Pharmaceuticals, Self Made",,,"Lianyungang, China",China,,,"Doctorate, Zhejiang University"
64,Investments,,,"Singapore, Singapore",New Zealand,Married,,
47,"E-cigarettes, Self Made",,,"Shenzhen, China",China,Married,,"Master, China Europe International Business School; Bachelor of Arts/Economics, Tongji University"
71,"Airport management, Self Made",,,"Mexico City, Mexico",Mexico,Married,3,"Master of Business Administration, Kellogg School of Management; Bachelor of Business Administration, Universidad Iberoamericana"
81,"Pipelines, Self Made",8,,"Dallas, Texas",United States,Married,3,"Master of Business Administration, LeTourneau University's School of Business"
67,Construction,,,"Madrid, Spain",Spain,Married,3,"Bachelor of Arts/Science, IESE Business School"
54,"Battery components, Self Made",,,"Changsha, China",China,Married,,
79,Campbell Soup,,,"Dublin, Ireland",Ireland,Married,2,
62,Investments,,,"Stockholm, Sweden",Sweden,,,"Bachelor of Arts/Science, Middlebury College"
55,Investments,,,"Stockholm, Sweden",Sweden,Married,,"Bachelor of Arts/Economics, Lund University"
58,Manufacturing,,,"Melbourne, Australia",Australia,Married,4,"Bachelor of Arts/Science, Monash University; LLB, Monash University"
85,"Berkshire Hathaway, Self Made",,,"Phoenix, Arizona",United States,Divorced,2,
58,"Cosmetics, Self Made",,,"Hangzhou, China",China,,,
75,"Construction, Self Made",,,"Shantou, China",China,Married,,
55,"Airport, Self Made",,,"Moscow, Russia",Russia,Single,,"Master of Arts/Science, Moscow State University"
69,"Construction, investments",,,"Madrid, Spain",Spain,Divorced,3,
40,Real estate,,,"Hong Kong, Hong Kong",Hong Kong,,,"Master of Business Administration, Harvard Business School; Bachelor of Science in Engineering, Stanford University"
78,"Hedge funds, Self Made",8,,"Lake Worth, Florida",United States,Married,,"Bachelor of Arts/Science, City College of New York; Doctorate, Princeton University"
77,"Bakeries, Self Made",,,"Paris, France",France,Married,2,
67,"Software, Self Made",,,"Toronto, Canada",Canada,,,"Master of Business Administration, The University of Western Ontario - Richard Ivey School of Business; Bachelor of Arts/Science, University of Guelph"
59,"Auto dealerships, Self Made",,,"Beijing, China",China,Married,,
47,"Education, Self Made",,,"Beijing, China",China,Married,,"Bachelor of Arts/Science, Peking University"
70,"Investments, Self Made",,,"Singapore, Singapore",Singapore,Married,2,
52,Diversified,,,"Hangzhou, China",China,,,
95,"Travel, Self Made",,,"Lugano, Switzerland",Switzerland,Married,2,
85,"Chemicals, investments, Self Made",,,"Vorden, Netherlands",Netherlands,Married,2,
77,"Investments, Self Made",8,1,"Palm Beach, Florida",United States,Married,2,"Bachelor of Arts/Science, Babson College; Master of Business Administration, Babson College"
61,Prosthetics,,,"Duderstadt, Germany",Germany,Divorced,2,
60,"Retailing, Self Made",,,"Mumbai, India",India,Married,2,"Master of Business Administration, Indian Institute of Management, Ahmedabad; B.Com, Mumbai University"
55,Investments,,,"Los Angeles, California",Australia,Divorced,3,
58,"Real estate, airport, Self Made",,,"Moscow, Russia",Russia,Married,3,"Master of Science, Russian State Academy of Management; Bachelor of Arts/Science, Simferopol State University"
79,"Hotels, investments",3,2,"Nicasio, California",United States,Married,4,"Bachelor of Arts/Science, Lake Forest College; Doctor of Jurisprudence, University of Chicago"
46,Beer,3,1,"New York, New York",United States,Married,,"Bachelor of Arts/Science, Harvard University"
57,"Payroll software, Self Made",8,2,"Highland Park, Illinois",United States,Married,,"Bachelor of Arts/Science, University of Illinois, Urbana-Champaign"
82,Auto parts,,,"Herzogenaurach, Germany",Germany,Married,,
71,"Pharmaceuticals, Self Made",8,2,"Tarrytown, New York",United States,Married,3,"Bachelor of Arts/Science, Cornell University; Medical Doctor, University of Virginia; Ph.D, University of Virginia"
77,Chemicals,,,"Hamburg, Germany",Germany,Married,3,
68,"Liquefied natural gas, Self Made",,,"Miami Beach, Florida",United States,Married,2,"Drop Out, University of Colorado"
51,"Brakes, investments",,,"Munich, Germany",Germany,Married,,
69,Food processing,5,2,"Springdale, Arkansas",United States,Single,2,"Bachelor of Arts/Science, Southern Methodist University"
,Heating and cooling equipment,,,"Battenberg, Germany",Germany,,,
58,Construction Vehicles,,,,Germany,,,
53,Construction Vehicles,,,,Germany,,,
57,"Electronics, Self Made",,,"Shanghai, China",China,Married,,"Master of Science in Engineering, Tsinghua University"
52,"Security software, Self Made",,,"Beijing, China",China,Married,,"Bachelor of Science, Xi'an Jiaotong University; Master of Science, Xi'an Jiaotong University"
99,"Slim-Fast, Self Made",9,3,"Palm Beach, Florida",United States,Married,6,"Diploma, High School"
75,Shoes,1,,"Boston, Massachusetts",United States,Married,3,
78,Shoes,1,,"Scarborough, Maine",United States,,3,
79,Shoes,1,,"Weston, Massachusetts",United States,Married,3,
71,"Engineering, construction",4,1,"San Francisco, California",United States,Married,3,"Doctor of Jurisprudence, Stanford University; Master of Business Administration, Stanford University; Bachelor of Arts/Science, University of Calif Davis"
56,"Investments, Self Made",,,"London, United Kingdom",Iceland,Married,3,"Bachelor of Arts/Science, New York University"
92,Liquor,,,"Palm Beach, Florida",Canada,"Widowed, Remarried",2,"Bachelor of Arts/Science, McGill University"
86,Consumer goods,,,"Delhi, India",India,Married,2,"Bachelor of Arts/Science, University of Miami"
81,"Car dealerships, Self Made",9,,"Boston, Massachusetts",United States,Single,,
39,"Video streaming app, Self Made",,,"Beijing, China",China,,,"Bachelor of Science in Engineering, Northeastern University; Bachelor of Engineering, Northeastern University Engineering"
75,"Fast food, Self Made",9,,"Las Vegas, Nevada",United States,Married,3,
75,"Fast food, Self Made",9,,"Las Vegas, Nevada",United States,Married,3,"Bachelor of Arts/Science, Oregon State University; Master of Science, University of Missouri; Ph.D, University of Missouri"
80,"Hedge funds, Self Made",9,3,"Boca Raton, Florida",United States,Married,2,"Master of Business Administration, Columbia Business School; Bachelor of Arts/Science, Hunter College"
76,Cement,,,"Delhi, India",India,Married,2,"Bachelor of Commerce, Delhi University; Chartered Accountant, Institute of Chartered Accountants of India"
72,Beef processing,,,"Omaha, Nebraska",United States,Divorced,,"Bachelor of Arts/Science, University of Denver"
55,"Aluminum, utilities, Self Made",,,"Moscow, Russia",Russia,Divorced,2,"Master of Science, Moscow State University; Master of Economics, Plekhanov Russian University of Economics"
57,"Software, Self Made",,,"Paralimni, Cyprus",Cyprus,,,"Master of Science, Saint Petersburg State University"
68,"Hedge funds, Self Made",7,,"New York, New York",United States,Married,,"Master of Business Administration, New York University; Bachelor of Arts/Science, University of California, San Diego"
62,"Plastic pipes, Self Made",,,"Ahmedabad, India",India,Married,2,
74,"Fertilizer, Self Made",,,"Curitiba, Brazil",Brazil,Divorced,3,
73,"Information technology, Self Made",,,"Westmount, Canada",Canada,Married,2,"Master of Business Administration, Laval University"
70,"Private equity, Self Made",9,1,"Beverly Hills, California",United States,Married,6,"Bachelor of Arts/Science, Western Michigan University"
65,Gas stations,3,1,"Knoxville, Tennessee",United States,Married,3,"Bachelor of Arts/Science, Emory University"
75,"Investments, Self Made",8,2,"New York, New York",United States,Married,2,"Master of Business Administration, Harvard Business School; Bachelor of Arts/Science, Harvard University"
53,"Music, Self Made",,,"New York, New York",United States,Married,3,
74,Engineering,,,"Pune, India",India,Married,1,"Master of Science, Massachusetts Institute of Technology"
62,Energy,,,"Istanbul, Turkey",Turkey,Married,1,
66,"Tobacco, Self Made",9,,"Franklin, Tennessee",United States,Married,3,"Diploma, High School; Drop Out, Western Kentucky University"
70,"Engineering, Self Made",,,"Graz, Austria",Austria,Married,2,
70,"Paper & related products, Self Made",,,"Yanzhou, China",China,Married,3,
76,"Real estate, Self Made",,,"Taipei, Taiwan",Taiwan,Married,2,
36,"Jewelry, Self Made",,,"Shenzhen, China",China,,,
77,"Coffee, shipping",,,"Bangkok, Thailand",Thailand,Married,3,
76,"Medical devices, Self Made",,,"Burgdorf, Switzerland",Switzerland,Married,3,
92,Tractors,,,"Delhi, India",India,Widowed,5,"Bachelor of Arts/Science, Punjab University; Master of Arts, Punjab University"
35,"Snapchat, Self Made",8,1,"Venice, California",United States,Single,,"Bachelor of Arts/Science, Stanford University"
49,"Shopping centers, Self Made",,,"Marbella, Spain",Spain,Separated,3,
64,"Aerospace, Self Made",9,,"Reno, Nevada",United States,Married,2,"Master of Business Administration, University of Nevada at Reno"
70,"Hotels, investments",3,3,"San Francisco, California",United States,Married,3,"Bachelor of Arts/Science, Menlo College"
77,"Semiconductors, Self Made",,,"Shangyu, China",China,,,
59,Diversified,,,"Istanbul, Turkey",Turkey,Married,1,"Bachelor of Arts/Science, Boston College"
77,"Steel production, Self Made",,,"Zhangjiagang, China",China,Married,2,
60,"Online games, investments, Self Made",,,"Shanghai, China",China,Divorced,1,"Master of Science, Shenzhen University; Bachelor of Arts/Science, Zhejiang University"
63,"Real estate, Self Made",8,1,"New York, New York",United States,Married,5,"Bachelor of Arts/Science, University of Pennsylvania, The Wharton School"
69,Diversified,,,"Manila, Philippines",Philippines,Married,2,"Bachelor of Science, De La Salle University"
71,"Diversified, Self Made",,,"Manila, Philippines",Philippines,Married,4,"Bachelor of Arts/Science, University of the East"
53,"Oil & gas, investments, Self Made",,,"Singapore, Singapore",India,Married,2,
64,"Investments, Self Made",9,,"Winnetka, Illinois",United States,Married,,
77,Real estate,4,1,"Palm Beach, Florida",United States,Married,5,"Fordham University; Bachelor of Arts/Science, University of Pennsylvania"
79,"Auto repair, Self Made",,,"Neustadt an der Waldnaab, Germany",Germany,Married,2,
74,"Retail, Self Made",8,,"Nanjing, China",United States,Married,2,"Bachelor of Arts/Science, Chinese Culture University; Master of Business Administration, Southeastern Louisiana University"
69,"TV shows, Self Made",10,2,"Montecito, California",United States,In Relationship,,"Bachelor of Arts/Science, Tennessee State University"
88,"Bakery chain, Self Made",,,"Shenyang, China",China,Married,3,
66,"Cobalt, Self Made",,,Singapore,Taiwan,,,
45,"Retail, Self Made",,,"Guangzhou, China",China,,,"Associate in Arts/Science, Zhongnan University of Economics and Law"
51,"WhatsApp, Self Made",8,3,"Palo Alto, California",United States,Married,1,"Bachelor of Arts/Science, Stanford University"
83,"Auto dealers, investments",,,"Dubai, United Arab Emirates",United Arab Emirates,Married,,
77,"Oil, investments",4,3,"Fort Worth, Texas",United States,Married,1,"Bachelor of Arts/Science, Yale University"
70,"Media, investments, Self Made",,,"Cape Town, South Africa",South Africa,Married,2,"Master of Business Administration, Columbia Business School; LLB, University of Witwatersrand"
45,Medical technology,,,"Melsungen, Germany",Germany,,,
75,"Herbal products, Self Made",,,"Los Angeles, California",Taiwan,Married,5,"Drop Out, Brigham Young University; Bachelor of Arts/Science, Kaohsiung Medical University"
86,Retail,,,"Sao Paulo, Brazil",Brazil,Married,6,"Bachelor of Arts/Science, Fundacao Getulio Vargas"
58,"Private equity, Self Made",,,"Zug, Switzerland",Switzerland,,,
92,"Gap, Self Made",7,2,"San Francisco, California",United States,Widowed,3,"Bachelor of Arts/Science, Stanford University"
79,"Banking, Self Made",9,2,"Dallas, Texas",United States,Married,6,"Bachelor of Arts/Science, Southern Methodist University; Doctor of Jurisprudence, Southern Methodist University"
67,"Pharmaceuticals, Self Made",,,"Paris, France",France,,,
55,"Private equity, Self Made",,,"Zug, Switzerland",Switzerland,Married,5,"Master of Business Administration, Brigham Young University"
89,"Gambling, Self Made",,,"Espelkamp, Germany",Germany,Married,4,
62,"Real estate, Self Made",,,"North York, Canada",Canada,Single,,"Bachelor of Arts/Science, York University"
76,"Financial services, Self Made",,,"Bristol, United Kingdom",United Kingdom,Married,2,
79,"Pharmaceuticals, Self Made",,,"Taizhou, China",China,Married,,
68,Diversified,,,"Singapore, Singapore",Singapore,Married,,
78,Valve manufacturing,1,,"Fort Lauderdale, Florida",United States,Widowed,,
58,"Media, Self Made",,,"Chennai, India",India,Married,1,"Master of Business Administration, University of Scranton"
48,"Cryptocurrency, Self Made",9,,"Berkeley, California",United States,,,
65,"Aerospace, Self Made",,,"Reno, Nevada",United States,Married,,
,"Soy sauce, Self Made",,,"foshan, China",China,,,
59,"Commodities, Self Made",6,,"Zug, Switzerland",United States,Single,,"Bachelor of Arts/Science, Duke University"
63,"Hotels, investments",1,2,"Marin County, California",United States,Married,5,"Doctor of Jurisprudence, Northwestern University; Bachelor of Arts/Science, Tufts University"
61,"Real estate, Self Made",,,"Hangzhou, China",China,Married,1,"Master of Business Administration, Zhejiang University"
61,"Hand tools, Self Made",,,"Hangzhou, China",China,Married,,"Master of Science, Xi'an Jiaotong University"
69,Diversified,,,"Mumbai, India",India,Married,2,"Bachelor of Arts/Science, University of Mumbai"
63,"Financial services, Self Made",,,"Zurich, Switzerland",Switzerland,,,
55,"Payments software, Self Made",,,"Amsterdam, Netherlands",Netherlands,Married,,
67,Diversified,,,"Manila, Philippines",Philippines,Married,4,"Bachelor of Science, De La Salle University"
66,Diversified,,,"Manila, Philippines",Philippines,Married,,"Bachelor of Business Administration, De La Salle University"
89,"Diversified, Self Made",,,"Manila, Philippines",Philippines,Married,6,"Bachelor of Arts/Science, Far Eastern University"
73,"Semiconductors, Self Made",,,"Hsinchu, Taiwan",Taiwan,Married,2,"Bachelor of Engineering, National Taiwan University; Master of Science in Engineering, University of Cincinnati"
84,Cable television,5,5,"Atlanta, Georgia",United States,Divorced,5,"Bachelor of Arts/Science, Brown University"
85,"Real estate, Self Made",10,1,"New York, New York",United States,Widowed,1,"Bachelor of Arts/Science, University of Virginia"
62,"Private equity, Self Made",,,"Zug, Switzerland",Switzerland,,,"Master of Business Administration, University of St. Gallen"
54,"Yahoo, Self Made",10,2,"Los Altos Hills, California",United States,Married,2,"Bachelor of Arts/Science, Stanford University; Master of Science, Stanford University"
54,"Machinery, Self Made",,,"Wuxi, China",China,Married,1,
54,"Chemicals, Self Made",,,"Jiaxing, China",China,Married,,
86,"Real estate, media, Self Made",8,4,"New York, New York",United States,Divorced,2,"LLM, Harvard University; Bachelor of Arts/Science, McGill University; Master of Business Administration, University of Pennsylvania, The Wharton School"
63,"Hedge funds, Self Made",,,"London, United Kingdom",Ireland,,,
67,"Oil, investments",4,2,"Fort Worth, Texas",United States,Married,,"Master of Business Administration, University of Pennsylvania, The Wharton School; Bachelor of Arts/Science, Yale University"
43,"Sensor systems, Self Made",,,"San Francisco, California",United States,Married,2,"Bachelor of Science, Cornell University; Master of Science, Massachusetts Institute of Technology"
41,"Sensor systems, Self Made",,,"San Francisco, California",United States,Married,3,"Master of Science, Massachusetts Institute of Technology; Bachelor of Science, Stanford University"
73,"Columbia Sportswear, Self Made",5,1,"Portland, Oregon",United States,Married,2,"Bachelor of Arts/Science, University of Oregon"
92,"Semiconductors, Self Made",,,"Hsinchu, Taiwan",Taiwan,Married,1,"Bachelor of Arts/Science, Massachusetts Institute of Technology; Master of Science, Massachusetts Institute of Technology; Ph.D, Stanford University"
78,"Real estate, Self Made",,,"Taipei, Taiwan",Taiwan,Married,3,
73,"Investments, Self Made",,,,Taiwan,Married,2,
53,"Flavorings, Self Made",,,"Hong Kong, Hong Kong",Hong Kong,Married,1,
69,"Software services, Self Made",,,"Bangalore, India",India,Married,2,"Master of Science, Bangalore University"
62,"Tires, diversified, Self Made",,,"Hattiesburg, Mississippi",United States,Married,2,
66,"Tires, diversified, Self Made",,,"Hattiesburg, Mississippi",United States,Divorced,2,"Bachelor of Arts/Science, University of Southern Mississippi"
40,"Spotify, Self Made",,,"Stockholm, Sweden",Sweden,Married,2,
62,Gap,2,2,"San Francisco, California",United States,Married,4,"Bachelor of Arts/Science, Princeton University; Master of Business Administration, Stanford Graduate School of Business"
61,Retail,,,"Berlin, Germany",Germany,Married,,
55,"Construction, Self Made",,,"Ankara, Turkey",Turkey,Married,3,
45,Private equity,,,"Chicago, Illinois",United States,Married,2,"Bachelor of Arts/Science, Michigan State University; Doctor of Jurisprudence, Vanderbilt University"
49,"Manufacturing, Self Made",,,"Weifang, China",China,,,"Master of Arts, Renmin University of China; Bachelor of Arts/Science, Tsinghua University; Ph.D, University of Maryland"
67,"Private equity, Self Made",8,3,"Los Angeles, California",United States,Married,3,"Bachelor of Arts/Science, Duke University; Doctor of Jurisprudence, University of Virginia"
44,"Online retailing, Self Made",8,,"Seoul, South Korea",United States,Married,1,"Bachelor of Arts/Science, Harvard University"
,"Soy sauce, Self Made",,,"Foshan, China",China,,,
59,"Pharmaceuticals, Self Made",,,"Hong Kong, Hong Kong",China,,,"Bachelor of Arts/Science, Guangdong Medical College"
70,"Financial services, Self Made",,,"St. Peter Port, Guernsey",Guernsey,Married,2,
20,Drugstores,,,,Germany,,,
,"Restaurants, Self Made",,,"Chengdu, China",China,Married,,
45,"Financial services, Self Made",,,"Shenzhen, China",China,,,
72,Casinos,,,"Kuala Lumpur, Malaysia",Malaysia,Married,3,"Harvard Business School; Bachelor of Arts/Science, University of London"
88,Consumer goods,,,"Mumbai, India",India,Married,2,"Master of Science in Engineering, Massachusetts Institute of Technology; Bachelor of Science in Engineering, University of Mumbai"
82,"Pet food, Self Made",7,4,"Brookville, Ohio",United States,Married,5,"Bachelor of Arts/Science, Ohio Northern University"
65,"Retail, Self Made",,,"Urumqi, China",China,Married,,
56,"Agriculture, land, Self Made",,,"Moscow, Russia",Russia,Married,3,"Bachelor of Arts/Science, Moscow Institute of Radioengineering, Electronics and Automation"
100,"Dole, real estate, Self Made",10,,"Ventura, California",United States,Widowed,3,"Drop Out, High School"
76,"Art collection, Self Made",,,"New York, New York",Monaco,Married,3,
69,"Investments, Self Made",,,"Manaus, Brazil",Brazil,Divorced,1,
,Candy,,,"Lugano, Switzerland",Italy,,,
,Candy,,,"Lugano, Switzerland",Italy,,,
69,Luxury goods,,,"Milan, Italy",Italy,,,
78,Luxury goods,,,"Milan, Italy",Italy,,,
56,Diversified,,,"Istanbul, Turkey",Turkey,Single,,
72,Liquor,4,1,"Delray Beach, Florida",United States,,,"Doctorate, University of North Carolina; Bachelor of Arts/Science, University of Vermont"
75,Investments,,,"Hurden, Switzerland",Switzerland,Married,2,"Doctorate, University of Zurich"
79,Medical devices,,,"Lugano, Switzerland",Switzerland,Married,3,"Master of Business Administration, SDA Bocconi School of Management; Bachelor of Science, University of Turin"
48,"Real estate, grains",,,"Delray Beach, Florida",United States,Divorced,22,"Drop Out, University of Rhode Island"
89,"Fashion retail, Self Made",,,"Hong Kong, Hong Kong",Hong Kong,Married,2,
69,"Measuring instruments, Self Made",,,"Hefei, China",China,Married,,
70,Finance,,,"Taipei, Taiwan",Taiwan,Married,1,"EMBA, National Taiwan University; Bachelor of Arts/Science, Tokai University"
62,"Computer networking, Self Made",6,,"Saratoga, California",United States,Married,2,"Bachelor of Arts/Science, San Francisco State University; Master of Science, Santa Clara University"
57,"Real estate, investments",,,"London, United Kingdom",Switzerland,Married,5,"Bachelor of Arts/Economics, University of Rhode Island"
78,"Real estate, Self Made",,,"Sydney, Australia",Australia,Married,3,"Diploma, High School"
74,"Tires, Self Made",,,"Zhaoyuan, China",China,Married,,
61,"Real estate, Self Made",,,"Shanghai, China",China,,,"Master of Business Administration, Macau University"
80,"Chicken processing, Self Made",,,"Rechterfeld, Germany",Germany,Married,4,
57,"Pearlescent pigments, Self Made",,,"Fuzhou, China",China,Married,,
58,"Construction, mining machinery, Self Made",,,"Hangzhou, China",China,,,
66,Dental materials,,,"Vaduz, Liechtenstein",Liechtenstein,Married,,
87,"Precision machinery, Self Made",,,"Ningbo, China",China,,,
86,"Real estate, investments, Self Made",9,3,"Newport Beach, California",United States,Married,3,"Bachelor of Arts/Science, Chapman University"
40,"Cryptocurrency, Self Made",8,,"San Francisco, California",United States,,,"Bachelor of Arts/Economics, Rice University; Master of Arts/Science, Rice University"
52,"Oil, mining, Self Made",,,"Moscow, Russia",Russia,Married,4,"Master of Laws, Irkutsk State University"
74,"Diversified, Self Made",,,"Ankara, Turkey",Turkey,Married,2,
57,"Business software, Self Made",8,1,"San Francisco, California",United States,Married,2,"Bachelor of Arts/Science, Brown University; Master of Business Administration, Stanford Graduate School of Business"
63,"Retail, agribusiness, Self Made",,,"Paradise Island, Bahamas",Australia,Married,2,
86,Insurance,5,,"Ormond Beach, Florida",United States,Married,,"Bachelor of Arts/Science, University of Florida"
55,Investments,,,"Shanghai, China",China,Widowed,,"Bachelor of Arts/Science, Shanghai University of Finance and Economics"
71,"Pharmaceuticals, Self Made",,,"Weihai, China",China,,,
73,"Finance, Self Made",,,"Dublin, Ireland",Ireland,Married,4,
52,"Pharmaceuticals, Self Made",,,"Lianyungang, China",China,,,
62,"Fashion, Self Made",,,"Los Angeles, California",United States,Widowed,1,"Drop Out, New York University; Bachelor of Architecture, Parsons School of Design"
69,"Poultry, Self Made",,,"Nanping, China",China,Married,2,
62,"Hedge funds, Self Made",7,3,"New York, New York",United States,Married,4,"Bachelor of Arts/Science, Columbia University"
64,"Investments, Self Made",8,,"Los Angeles, California",United States,Divorced,,"Bachelor of Arts/Science, Dartmouth College"
67,"Pharmaceuticals, Self Made",8,,"Tianjin, China",United States,Married,,
78,Automotive,,,"Tel Aviv, Israel",Israel,,,
83,"SAP, Self Made",,,"Weinheim, Germany",Germany,Married,,"Master of Science, University of Saarland"
76,"Hospitals, Self Made",,,"Grebenhain, Germany",Germany,Married,2,
64,"Real estate, Self Made",,,"Shenzhen, China",Canada,,,
81,Finance,,,"Saint Petersburg, Florida",United States,Married,2,"Master of Business Administration, Harvard Business School; Bachelor of Arts/Science, Harvard University; Doctor of Jurisprudence, Stetson University"
74,"Sunglasses, Self Made",9,,"San Juan Islands, Washington",United States,Married,4,"Drop Out, University of Southern California"
76,"Damaged cars, Self Made",,,"Franklin, Tennessee",United States,Married,2,
